"pages","dividfbrootlink1precedingsiblingtitle1textselftext"
"44.html","Il Gubbio abbraccia la citt�, folla di tifosi per la presentazione - Corriere dell'Umbria"
"45.html","Cunzi colpito da tumore, la Narnese: "Pasquale, para anche questo rigore" - Corriere dell'Umbria"
"52.html","L'italiano Luca Parmitano diventa il primo dj nello spazio - Corriere dell'Umbria"
"24.html","Migranti, Salvini: "Se qualcuno ha nostalgia di sbarchi e PD lo dica" - Corriere dell'Umbria"
"34.html","Governo, Salvini: "Toninelli blocca gronda, non volevano neanche Olimpiadi" - Corriere dell'Umbria"
"9.html","Scuola Carducci, Meloni: "Inaugurazione per l'inizio delle lezioni" - Corriere dell'Umbria"
"43.html","Ternana, l'esordio in anticipo: a Rieti si gioca sabato 24 in notturna - Corriere dell'Umbria"
