"pages","dividarticlesidebardiv1span1precedingsiblingp1textselftext","","","","","","","","","","","","","","","","","dividwrapperhead1title1text1selftext","piditemphotodescriptionspan1precedingsiblingp1br1followingsiblingtext1selftext","aidsitetitleprecedingsiblingtextselftext","","piditemtagsdiv1p1textselftext","","","","","","","","","","","","","","","","","sectionidb5414980015591330510100precedingsiblingprecedingsiblingp1br1followingsiblingtext1selftext","piditemtagsul1div1p1textselftext","","","","","","","","","","","","","","","","","aidtoolipprecedingsiblingtextselftext","","piditemphotodescriptionprecedingsiblingli1div1p1textselftext","","","","","","","","","","","","","","","",""
"41.html","Washington has reportedly asked Greece to make a contribution to a multinational naval force that will monitor the Persian Gulf in order to protect the freedom of navigation.","","","","","","","","","","","","","","","","","US request for Greek assistance in Persian Gulf | News | ekathimerini.com","","NEWS","|","Washington has reportedly asked Greece to make a contribution to a multinational naval force that will monitor the Persian Gulf in order to protect the freedom of navigation.","","","","","","","","","","","","","","","","","","Washington has reportedly asked Greece to make a contribution to a multinational naval force that will monitor the Persian Gulf in order to protect the freedom of navigation.","","","","","","","","","","","","","","","","","Developed by EWORX S.A.","|","Washington has reportedly asked Greece to make a contribution to a multinational naval force that will monitor the Persian Gulf in order to protect the freedom of navigation.","","","","","","","","","","","","","","","",""
"13.html","Though very few holidaymakers who visit the Greek islands are left dissatisfied with their experience, most view it as the reductive ?sun and sea? stereotype.","","","","","","","","","","","","","","","","","Cultural tourism on the rise on the Greek islands | Life | ekathimerini.com","","LIFE","|","Though very few holidaymakers who visit the Greek islands are left dissatisfied with their experience, most view it as the reductive ?sun and sea? stereotype.","","","","","","","","","","","","","","","","","","","","","","","","","","","","","","","","","","","Developed by EWORX S.A.","|","","","","","","","","","","","","","","","","",""
"33.html","The first 200 years are the difficult ones, my friend Vasilis Papavasiliou says sarcastically whenever he gets the chance, referring to the approaching bicentennial of the start of the Greek War of Independence, leaving those listening to wonder about the precise meaning of his statement.","The anniversary will apparently be quite a celebration, since the government has entrusted Gianna Angelopoulos-Daskalaki, the former head of the Organizing Committee for the 2004 Athens Olympics, with its arrangement.","In my opinion, he may either mean that since there has been no significant change in the Greek mind-set over the past 200 years, there is not much hope of anything different in the next 200, or that since we managed to survive the past two centuries despite our collective weaknesses, we can hope for something better from now on.","","","","","","","","","","","","","","","Next 200 years will also be difficult | Comment | ekathimerini.com","The anniversary will apparently be quite a celebration, since the government has entrusted Gianna Angelopoulos-Daskalaki, the former head of the Organizing Committee for the 2004 Athens Olympics, with its arrangement.","COMMENT","|","The first 200 years are the difficult ones, my friend Vasilis Papavasiliou says sarcastically whenever he gets the chance, referring to the approaching bicentennial of the start of the Greek War of Independence, leaving those listening to wonder about the precise meaning of his statement.","The anniversary will apparently be quite a celebration, since the government has entrusted Gianna Angelopoulos-Daskalaki, the former head of the Organizing Committee for the 2004 Athens Olympics, with its arrangement.","In my opinion, he may either mean that since there has been no significant change in the Greek mind-set over the past 200 years, there is not much hope of anything different in the next 200, or that since we managed to survive the past two centuries despite our collective weaknesses, we can hope for something better from now on.","","","","","","","","","","","","","","","The anniversary will apparently be quite a celebration, since the government has entrusted Gianna Angelopoulos-Daskalaki, the former head of the Organizing Committee for the 2004 Athens Olympics, with its arrangement.","The first 200 years are the difficult ones, my friend Vasilis Papavasiliou says sarcastically whenever he gets the chance, referring to the approaching bicentennial of the start of the Greek War of Independence, leaving those listening to wonder about the precise meaning of his statement.","The anniversary will apparently be quite a celebration, since the government has entrusted Gianna Angelopoulos-Daskalaki, the former head of the Organizing Committee for the 2004 Athens Olympics, with its arrangement.","In my opinion, he may either mean that since there has been no significant change in the Greek mind-set over the past 200 years, there is not much hope of anything different in the next 200, or that since we managed to survive the past two centuries despite our collective weaknesses, we can hope for something better from now on.","","","","","","","","","","","","","","","Developed by EWORX S.A.","|","The first 200 years are the difficult ones, my friend Vasilis Papavasiliou says sarcastically whenever he gets the chance, referring to the approaching bicentennial of the start of the Greek War of Independence, leaving those listening to wonder about the precise meaning of his statement.","The anniversary will apparently be quite a celebration, since the government has entrusted Gianna Angelopoulos-Daskalaki, the former head of the Organizing Committee for the 2004 Athens Olympics, with its arrangement.","In my opinion, he may either mean that since there has been no significant change in the Greek mind-set over the past 200 years, there is not much hope of anything different in the next 200, or that since we managed to survive the past two centuries despite our collective weaknesses, we can hope for something better from now on.","","","","","","","","","","","","","",""
"8.html","A pregnant woman was killed when a train collided with a car on the section of the intercity railway network near Diavata, in northern Greece, shortly before 3 p.m. on Monday, a local news website reported.","The train had been conducting the Alexandroupoli-Thessaloniki service when the collision occured.","","","","","","","","","","","","","","","","Woman killed in train-car collision near Diavata, northern Greece | News | ekathimerini.com","The train had been conducting the Alexandroupoli-Thessaloniki service when the collision occured.","NEWS","|","A pregnant woman was killed when a train collided with a car on the section of the intercity railway network near Diavata, in northern Greece, shortly before 3 p.m. on Monday, a local news website reported.","The train had been conducting the Alexandroupoli-Thessaloniki service when the collision occured.","","","","","","","","","","","","","","","","The train had been conducting the Alexandroupoli-Thessaloniki service when the collision occured.","A pregnant woman was killed when a train collided with a car on the section of the intercity railway network near Diavata, in northern Greece, shortly before 3 p.m. on Monday, a local news website reported.","The train had been conducting the Alexandroupoli-Thessaloniki service when the collision occured.","","","","","","","","","","","","","","","","Developed by EWORX S.A.","|","A pregnant woman was killed when a train collided with a car on the section of the intercity railway network near Diavata, in northern Greece, shortly before 3 p.m. on Monday, a local news website reported.","The train had been conducting the Alexandroupoli-Thessaloniki service when the collision occured.","","","","","","","","","","","","","","",""
"52.html","Recep Tayyip Erdogan's spokesman and special adviser Ibrahim Kalin has lashed out at critics of the Turkish president, saying accusations of heavy-handed treatment against political rivals and that Turkey is straying from its western alliance are ?baseless.?","","","","","","","","","","","","","","","","","Erdogan spokesman dismisses criticism of Turkish president as 'baseless' | News | ekathimerini.com","","NEWS","|","Recep Tayyip Erdogan's spokesman and special adviser Ibrahim Kalin has lashed out at critics of the Turkish president, saying accusations of heavy-handed treatment against political rivals and that Turkey is straying from its western alliance are ?baseless.?","","","","","","","","","","","","","","","","","","Recep Tayyip Erdogan's spokesman and special adviser Ibrahim Kalin has lashed out at critics of the Turkish president, saying accusations of heavy-handed treatment against political rivals and that Turkey is straying from its western alliance are ?baseless.?","","","","","","","","","","","","","","","","","Developed by EWORX S.A.","|","Recep Tayyip Erdogan's spokesman and special adviser Ibrahim Kalin has lashed out at critics of the Turkish president, saying accusations of heavy-handed treatment against political rivals and that Turkey is straying from its western alliance are ?baseless.?","","","","","","","","","","","","","","","",""
"36.html","Defense officials and diplomats in Athens and Nicosia are on standby for potential developments in the Eastern Mediterrenanean in the coming period while international observers await a fresh peace push aimed at reunifying Cyprus.","","","","","","","","","","","","","","","","","Athens, Nicosia on standby for developments in East Med | News | ekathimerini.com","","NEWS","|","Defense officials and diplomats in Athens and Nicosia are on standby for potential developments in the Eastern Mediterrenanean in the coming period while international observers await a fresh peace push aimed at reunifying Cyprus.","","","","","","","","","","","","","","","","","","Defense officials and diplomats in Athens and Nicosia are on standby for potential developments in the Eastern Mediterrenanean in the coming period while international observers await a fresh peace push aimed at reunifying Cyprus.","","","","","","","","","","","","","","","","","Developed by EWORX S.A.","|","Defense officials and diplomats in Athens and Nicosia are on standby for potential developments in the Eastern Mediterrenanean in the coming period while international observers await a fresh peace push aimed at reunifying Cyprus.","","","","","","","","","","","","","","","",""
"55.html","The body of a woman found on Crete is feared to be that of an American scientist, missing since last week.","Reports Tuesday said a body was found inside a cave near the settlement of Xamoudochori, in Hania, about 10 kilometers from the place where Suzanne Eaton was last seen last Tuesday.","Eaton, a 59-year-old molecular biologist at the Max Planck Institute at Dresden University, Germany, had been attending the Orthodox Academy in Hania.","Eaton was the mother of two sons and the wife of British scientist Tony Hyman.","?It is with enormous sadness and regret that we announce the tragic demise of our dearest friend and colleague, Suzanne Eaton,? the institute said in a statement issued on Tuesday.","?We are deeply shocked and disturbed by this tragic event. Suzanne was an outstanding and inspiring scientist, a loving spouse and mother, an athlete as well as a truly wonderful person beloved to us all. Her loss is unbearable,? it said.","","","","","","","","","","","","Woman found dead on Crete feared to be missing US scientist | News | ekathimerini.com","Reports Tuesday said a body was found inside a cave near the settlement of Xamoudochori, in Hania, about 10 kilometers from the place where Suzanne Eaton was last seen last Tuesday.","NEWS","|","The body of a woman found on Crete is feared to be that of an American scientist, missing since last week.","Reports Tuesday said a body was found inside a cave near the settlement of Xamoudochori, in Hania, about 10 kilometers from the place where Suzanne Eaton was last seen last Tuesday.","Eaton, a 59-year-old molecular biologist at the Max Planck Institute at Dresden University, Germany, had been attending the Orthodox Academy in Hania.","Eaton was the mother of two sons and the wife of British scientist Tony Hyman.","?It is with enormous sadness and regret that we announce the tragic demise of our dearest friend and colleague, Suzanne Eaton,? the institute said in a statement issued on Tuesday.","?We are deeply shocked and disturbed by this tragic event. Suzanne was an outstanding and inspiring scientist, a loving spouse and mother, an athlete as well as a truly wonderful person beloved to us all. Her loss is unbearable,? it said.","","","","","","","","","","","","Reports Tuesday said a body was found inside a cave near the settlement of Xamoudochori, in Hania, about 10 kilometers from the place where Suzanne Eaton was last seen last Tuesday.","The body of a woman found on Crete is feared to be that of an American scientist, missing since last week.","Reports Tuesday said a body was found inside a cave near the settlement of Xamoudochori, in Hania, about 10 kilometers from the place where Suzanne Eaton was last seen last Tuesday.","Eaton, a 59-year-old molecular biologist at the Max Planck Institute at Dresden University, Germany, had been attending the Orthodox Academy in Hania.","Eaton was the mother of two sons and the wife of British scientist Tony Hyman.","?It is with enormous sadness and regret that we announce the tragic demise of our dearest friend and colleague, Suzanne Eaton,? the institute said in a statement issued on Tuesday.","?We are deeply shocked and disturbed by this tragic event. Suzanne was an outstanding and inspiring scientist, a loving spouse and mother, an athlete as well as a truly wonderful person beloved to us all. Her loss is unbearable,? it said.","","","","","","","","","","","","Developed by EWORX S.A.","|","The body of a woman found on Crete is feared to be that of an American scientist, missing since last week.","Reports Tuesday said a body was found inside a cave near the settlement of Xamoudochori, in Hania, about 10 kilometers from the place where Suzanne Eaton was last seen last Tuesday.","Eaton, a 59-year-old molecular biologist at the Max Planck Institute at Dresden University, Germany, had been attending the Orthodox Academy in Hania.","Eaton was the mother of two sons and the wife of British scientist Tony Hyman.","?It is with enormous sadness and regret that we announce the tragic demise of our dearest friend and colleague, Suzanne Eaton,? the institute said in a statement issued on Tuesday.","?We are deeply shocked and disturbed by this tragic event. Suzanne was an outstanding and inspiring scientist, a loving spouse and mother, an athlete as well as a truly wonderful person beloved to us all. Her loss is unbearable,? it said.","","","","","","","","","","",""
"35.html","The coming period will be ?decisive? for Cyprus, government spokesman Prodromos Prodromou told reporters on Saturday amid mounting expectations of a new United Nations-mediated bid to reunify the divided island.","","","","","","","","","","","","","","","","","Coming period ?decisive? for Cyprus, spokesman says | News | ekathimerini.com","","NEWS","|","The coming period will be ?decisive? for Cyprus, government spokesman Prodromos Prodromou told reporters on Saturday amid mounting expectations of a new United Nations-mediated bid to reunify the divided island.","","","","","","","","","","","","","","","","","","The coming period will be ?decisive? for Cyprus, government spokesman Prodromos Prodromou told reporters on Saturday amid mounting expectations of a new United Nations-mediated bid to reunify the divided island.","","","","","","","","","","","","","","","","","Developed by EWORX S.A.","|","The coming period will be ?decisive? for Cyprus, government spokesman Prodromos Prodromou told reporters on Saturday amid mounting expectations of a new United Nations-mediated bid to reunify the divided island.","","","","","","","","","","","","","","","",""
"38.html","A fourth Turkish ship, the Oruc Reis, is on its way to the Eastern Mediterranean, Turkish Foreign Minister Mevlut Cavusoglu wrote on Twitter on Monday.","","","","","","","","","","","","","","","","","Cavusoglu: Fourth Turkish ship on way to East Med | News | ekathimerini.com","","NEWS","|","A fourth Turkish ship, the Oruc Reis, is on its way to the Eastern Mediterranean, Turkish Foreign Minister Mevlut Cavusoglu wrote on Twitter on Monday.","","","","","","","","","","","","","","","","","","A fourth Turkish ship, the Oruc Reis, is on its way to the Eastern Mediterranean, Turkish Foreign Minister Mevlut Cavusoglu wrote on Twitter on Monday.","","","","","","","","","","","","","","","","","Developed by EWORX S.A.","|","A fourth Turkish ship, the Oruc Reis, is on its way to the Eastern Mediterranean, Turkish Foreign Minister Mevlut Cavusoglu wrote on Twitter on Monday.","","","","","","","","","","","","","","","",""
"21.html","The Archaeological Collection of Koufonissi, housed near the island's port, presents a selection of fascinating finds from excavations carried out by the British School at Athens and the University of Cambridge for more than a decade on the nearby islet of Daskalio, once a promontory of Keros, where they discovered the remains of Early Cycladic (3,200-2,100 BC) settlements. The exhibition is arranged in two sections, with the first showing evidence of life at Daskalio and the extensive trade networks it had developed, and the second dedicated to the excavation. Opening hours are Wednesdays to Mondays from 9 a.m. to noon and 5 to 9.30 p.m. Admission is free of charge.","","","","","","","","","","","","","","","","","Keros & Daskalio | Ano Koufonissi | To September 30 | What?s On | ekathimerini.com","","WHAT?S ON","|","The Archaeological Collection of Koufonissi, housed near the island's port, presents a selection of fascinating finds from excavations carried out by the British School at Athens and the University of Cambridge for more than a decade on the nearby islet of Daskalio, once a promontory of Keros, where they discovered the remains of Early Cycladic (3,200-2,100 BC) settlements. The exhibition is arranged in two sections, with the first showing evidence of life at Daskalio and the extensive trade networks it had developed, and the second dedicated to the excavation. Opening hours are Wednesdays to Mondays from 9 a.m. to noon and 5 to 9.30 p.m. Admission is free of charge.","","","","","","","","","","","","","","","","","","The Archaeological Collection of Koufonissi, housed near the island's port, presents a selection of fascinating finds from excavations carried out by the British School at Athens and the University of Cambridge for more than a decade on the nearby islet of Daskalio, once a promontory of Keros, where they discovered the remains of Early Cycladic (3,200-2,100 BC) settlements. The exhibition is arranged in two sections, with the first showing evidence of life at Daskalio and the extensive trade networks it had developed, and the second dedicated to the excavation. Opening hours are Wednesdays to Mondays from 9 a.m. to noon and 5 to 9.30 p.m. Admission is free of charge.","","","","","","","","","","","","","","","","","Developed by EWORX S.A.","|","The Archaeological Collection of Koufonissi, housed near the island's port, presents a selection of fascinating finds from excavations carried out by the British School at Athens and the University of Cambridge for more than a decade on the nearby islet of Daskalio, once a promontory of Keros, where they discovered the remains of Early Cycladic (3,200-2,100 BC) settlements. The exhibition is arranged in two sections, with the first showing evidence of life at Daskalio and the extensive trade networks it had developed, and the second dedicated to the excavation. Opening hours are Wednesdays to Mondays from 9 a.m. to noon and 5 to 9.30 p.m. Admission is free of charge.","","","","","","","","","","","","","","","",""
"46.html","A monastery was evacuated and the residents of three villages were told to be ready to leave after a big fire broke out inside firestland in central Evia early Tuesday morning.","The fire service was alerted shortly after 3 a.m. on a blaze in the the area of Agrilitsa, in the municipality of Dirfys-Messapia, and send 80 firemen with 39 vehicles, who are assisted by four aircraft and two helicopters.","Authorities evacuated the Monastery of Panagia Makrymallis for precautionary reasons and the villages of Agrilitsa, Kondodespoti and Makrymalli are on alert, TV channel SKAI reported.","","","","","","","","","","","","","","","Fire breaks out in Evia, monastery evacuated | News | ekathimerini.com","The fire service was alerted shortly after 3 a.m. on a blaze in the the area of Agrilitsa, in the municipality of Dirfys-Messapia, and send 80 firemen with 39 vehicles, who are assisted by four aircraft and two helicopters.","NEWS","|","A monastery was evacuated and the residents of three villages were told to be ready to leave after a big fire broke out inside firestland in central Evia early Tuesday morning.","The fire service was alerted shortly after 3 a.m. on a blaze in the the area of Agrilitsa, in the municipality of Dirfys-Messapia, and send 80 firemen with 39 vehicles, who are assisted by four aircraft and two helicopters.","Authorities evacuated the Monastery of Panagia Makrymallis for precautionary reasons and the villages of Agrilitsa, Kondodespoti and Makrymalli are on alert, TV channel SKAI reported.","","","","","","","","","","","","","","","The fire service was alerted shortly after 3 a.m. on a blaze in the the area of Agrilitsa, in the municipality of Dirfys-Messapia, and send 80 firemen with 39 vehicles, who are assisted by four aircraft and two helicopters.","A monastery was evacuated and the residents of three villages were told to be ready to leave after a big fire broke out inside firestland in central Evia early Tuesday morning.","The fire service was alerted shortly after 3 a.m. on a blaze in the the area of Agrilitsa, in the municipality of Dirfys-Messapia, and send 80 firemen with 39 vehicles, who are assisted by four aircraft and two helicopters.","Authorities evacuated the Monastery of Panagia Makrymallis for precautionary reasons and the villages of Agrilitsa, Kondodespoti and Makrymalli are on alert, TV channel SKAI reported.","","","","","","","","","","","","","","","Developed by EWORX S.A.","|","A monastery was evacuated and the residents of three villages were told to be ready to leave after a big fire broke out inside firestland in central Evia early Tuesday morning.","The fire service was alerted shortly after 3 a.m. on a blaze in the the area of Agrilitsa, in the municipality of Dirfys-Messapia, and send 80 firemen with 39 vehicles, who are assisted by four aircraft and two helicopters.","Authorities evacuated the Monastery of Panagia Makrymallis for precautionary reasons and the villages of Agrilitsa, Kondodespoti and Makrymalli are on alert, TV channel SKAI reported.","","","","","","","","","","","","","",""
"49.html","Authorities on the southeastern Aegean island of Rhodes are investigating the death of two sisters in a hotel swimming pool the previous evening.","","","","","","","","","","","","","","","","","Two teenage sisters drown in Rhodes hotel pool | News | ekathimerini.com","","NEWS","|","","","","","","","","","","","","","","","","","","","","","","","","","","","","","","","","","","","","Developed by EWORX S.A.","|","Authorities on the southeastern Aegean island of Rhodes are investigating the death of two sisters in a hotel swimming pool the previous evening.","","","","","","","","","","","","","","","",""
"40.html","Following a brief break last week, Prime Minister Kyriakos Mitsotakis is bracing for a flurry of activity with upcoming visits to Paris and Berlin where he is to promote a series of economic reforms and investment initiatives.","","","","","","","","","","","","","","","","","PM to promote reforms, investments on EU trips | News | ekathimerini.com","","NEWS","|","Following a brief break last week, Prime Minister Kyriakos Mitsotakis is bracing for a flurry of activity with upcoming visits to Paris and Berlin where he is to promote a series of economic reforms and investment initiatives.","","","","","","","","","","","","","","","","","","Following a brief break last week, Prime Minister Kyriakos Mitsotakis is bracing for a flurry of activity with upcoming visits to Paris and Berlin where he is to promote a series of economic reforms and investment initiatives.","","","","","","","","","","","","","","","","","Developed by EWORX S.A.","|","Following a brief break last week, Prime Minister Kyriakos Mitsotakis is bracing for a flurry of activity with upcoming visits to Paris and Berlin where he is to promote a series of economic reforms and investment initiatives.","","","","","","","","","","","","","","","",""
