"pages","dividarticlesidebardiv1span1precedingsiblingp1textselftext","","","","","","","","","","","","","","","","","dividwrapperhead1title1text1selftext","piditemphotodescriptionspan1precedingsiblingp1br1followingsiblingtext1selftext","aidsitetitleprecedingsiblingtextselftext","","piditemtagsdiv1p1textselftext","","","","","","","","","","","","","","","","","sectionidb5414980015591330510100precedingsiblingprecedingsiblingp1br1followingsiblingtext1selftext","piditemtagsul1div1p1textselftext","","","","","","","","","","","","","","","","","aidtoolipprecedingsiblingtextselftext","","piditemphotodescriptionprecedingsiblingli1div1p1textselftext","","","","","","","","","","","","","","","",""
"56.html","Police inspections at airports are to become stricter from this week for European citizens traveling to countries that are not members of the border-free Schengen area.","","","","","","","","","","","","","","","","","Stricter inspections from travel to and from non-Schengen countries | News | ekathimerini.com","","NEWS","|","Police inspections at airports are to become stricter from this week for European citizens traveling to countries that are not members of the border-free Schengen area.","","","","","","","","","","","","","","","","","","Police inspections at airports are to become stricter from this week for European citizens traveling to countries that are not members of the border-free Schengen area.","","","","","","","","","","","","","","","","","Developed by EWORX S.A.","|","Police inspections at airports are to become stricter from this week for European citizens traveling to countries that are not members of the border-free Schengen area.","","","","","","","","","","","","","","","",""
"59.html","After a public outcry over a BBC story referring to a Macedonian minority in Greece and a Macedonian language, the British broadcaster added a section to the report on Saturday outlining Greece?s position.","","","","","","","","","","","","","","","","","BBC updates controversial story following Greek uproar | News | ekathimerini.com","","NEWS","|","After a public outcry over a BBC story referring to a Macedonian minority in Greece and a Macedonian language, the British broadcaster added a section to the report on Saturday outlining Greece?s position.","","","","","","","","","","","","","","","","","","After a public outcry over a BBC story referring to a Macedonian minority in Greece and a Macedonian language, the British broadcaster added a section to the report on Saturday outlining Greece?s position.","","","","","","","","","","","","","","","","","Developed by EWORX S.A.","|","After a public outcry over a BBC story referring to a Macedonian minority in Greece and a Macedonian language, the British broadcaster added a section to the report on Saturday outlining Greece?s position.","","","","","","","","","","","","","","","",""
"28.html","The bicentennial of the start of the Greek War of Independence, which Greece will mark in 2021, is indeed important and we ought to celebrate it. It could also serve as a catalyst to bring Greeks of the diaspora closer to the homeland and an opportunity to rebuild the Greek brand, which has suffered tremendously as a result of the financial crisis. However, we must steer clear of tasteless displays of jingoism.","The 200th anniversary is also a very good opportunity to better learn who we are as a people. The history of the revolution includes countless events which are completely unknown to the vast majority of contemporary Greeks. Next to the infinite examples of the greatness shown by Greek revolutionaries such as Georgios Karaiskakis, Papaflessas and many others, there was civil strife, tribalism, nepotism and the repeated failures of the leading figures of the time to build a consensus.","Over time, all of this was forgotten, because we needed a national narrative without inconvenient footnotes. But considering that it?s been two centuries since then, and the same patterns of behavior keep re-emerging as if they were ingrained in our DNA, it would be a good idea to start relearning our story coolheadedly, without glossing over the difficult bits.","It would be useful, for example, for us to know and explain that the sacred cause of the revolution was put at risk at critical moments by civil strife. Who knows, it might make us more suspicious of the preachers of division, who irresponsibly ? if not criminally ? have dragged the country through crises every 30-40 years.","The anniversary of the revolution is yet another opportunity to see how wise Greek diplomacy was from the beginning. It cultivated philhellenism with mastery and played its cards right with the Great Powers of the time. This is a chapter of history we ignore, because we prefer to remember only the historical events in which we appear as victims. Greece became independent and grew because of an unbeatable combination of heroism and wise diplomacy.","In this sense, the bicentenary is a milestone. An opportunity to look back, deepen our self-knowledge and set goals for the future. We should not forget that a people who do not know every aspect of their history are doomed to relive some of its darker chapters.","","","","","","","","","","","","A celebration that could serve as a catalyst | Comment | ekathimerini.com","The 200th anniversary is also a very good opportunity to better learn who we are as a people. The history of the revolution includes countless events which are completely unknown to the vast majority of contemporary Greeks. Next to the infinite examples of the greatness shown by Greek revolutionaries such as Georgios Karaiskakis, Papaflessas and many others, there was civil strife, tribalism, nepotism and the repeated failures of the leading figures of the time to build a consensus.","COMMENT","|","The bicentennial of the start of the Greek War of Independence, which Greece will mark in 2021, is indeed important and we ought to celebrate it. It could also serve as a catalyst to bring Greeks of the diaspora closer to the homeland and an opportunity to rebuild the Greek brand, which has suffered tremendously as a result of the financial crisis. However, we must steer clear of tasteless displays of jingoism.","The 200th anniversary is also a very good opportunity to better learn who we are as a people. The history of the revolution includes countless events which are completely unknown to the vast majority of contemporary Greeks. Next to the infinite examples of the greatness shown by Greek revolutionaries such as Georgios Karaiskakis, Papaflessas and many others, there was civil strife, tribalism, nepotism and the repeated failures of the leading figures of the time to build a consensus.","Over time, all of this was forgotten, because we needed a national narrative without inconvenient footnotes. But considering that it?s been two centuries since then, and the same patterns of behavior keep re-emerging as if they were ingrained in our DNA, it would be a good idea to start relearning our story coolheadedly, without glossing over the difficult bits.","It would be useful, for example, for us to know and explain that the sacred cause of the revolution was put at risk at critical moments by civil strife. Who knows, it might make us more suspicious of the preachers of division, who irresponsibly ? if not criminally ? have dragged the country through crises every 30-40 years.","The anniversary of the revolution is yet another opportunity to see how wise Greek diplomacy was from the beginning. It cultivated philhellenism with mastery and played its cards right with the Great Powers of the time. This is a chapter of history we ignore, because we prefer to remember only the historical events in which we appear as victims. Greece became independent and grew because of an unbeatable combination of heroism and wise diplomacy.","In this sense, the bicentenary is a milestone. An opportunity to look back, deepen our self-knowledge and set goals for the future. We should not forget that a people who do not know every aspect of their history are doomed to relive some of its darker chapters.","","","","","","","","","","","","The 200th anniversary is also a very good opportunity to better learn who we are as a people. The history of the revolution includes countless events which are completely unknown to the vast majority of contemporary Greeks. Next to the infinite examples of the greatness shown by Greek revolutionaries such as Georgios Karaiskakis, Papaflessas and many others, there was civil strife, tribalism, nepotism and the repeated failures of the leading figures of the time to build a consensus.","The bicentennial of the start of the Greek War of Independence, which Greece will mark in 2021, is indeed important and we ought to celebrate it. It could also serve as a catalyst to bring Greeks of the diaspora closer to the homeland and an opportunity to rebuild the Greek brand, which has suffered tremendously as a result of the financial crisis. However, we must steer clear of tasteless displays of jingoism.","The 200th anniversary is also a very good opportunity to better learn who we are as a people. The history of the revolution includes countless events which are completely unknown to the vast majority of contemporary Greeks. Next to the infinite examples of the greatness shown by Greek revolutionaries such as Georgios Karaiskakis, Papaflessas and many others, there was civil strife, tribalism, nepotism and the repeated failures of the leading figures of the time to build a consensus.","Over time, all of this was forgotten, because we needed a national narrative without inconvenient footnotes. But considering that it?s been two centuries since then, and the same patterns of behavior keep re-emerging as if they were ingrained in our DNA, it would be a good idea to start relearning our story coolheadedly, without glossing over the difficult bits.","It would be useful, for example, for us to know and explain that the sacred cause of the revolution was put at risk at critical moments by civil strife. Who knows, it might make us more suspicious of the preachers of division, who irresponsibly ? if not criminally ? have dragged the country through crises every 30-40 years.","The anniversary of the revolution is yet another opportunity to see how wise Greek diplomacy was from the beginning. It cultivated philhellenism with mastery and played its cards right with the Great Powers of the time. This is a chapter of history we ignore, because we prefer to remember only the historical events in which we appear as victims. Greece became independent and grew because of an unbeatable combination of heroism and wise diplomacy.","In this sense, the bicentenary is a milestone. An opportunity to look back, deepen our self-knowledge and set goals for the future. We should not forget that a people who do not know every aspect of their history are doomed to relive some of its darker chapters.","","","","","","","","","","","","Developed by EWORX S.A.","|","The bicentennial of the start of the Greek War of Independence, which Greece will mark in 2021, is indeed important and we ought to celebrate it. It could also serve as a catalyst to bring Greeks of the diaspora closer to the homeland and an opportunity to rebuild the Greek brand, which has suffered tremendously as a result of the financial crisis. However, we must steer clear of tasteless displays of jingoism.","The 200th anniversary is also a very good opportunity to better learn who we are as a people. The history of the revolution includes countless events which are completely unknown to the vast majority of contemporary Greeks. Next to the infinite examples of the greatness shown by Greek revolutionaries such as Georgios Karaiskakis, Papaflessas and many others, there was civil strife, tribalism, nepotism and the repeated failures of the leading figures of the time to build a consensus.","Over time, all of this was forgotten, because we needed a national narrative without inconvenient footnotes. But considering that it?s been two centuries since then, and the same patterns of behavior keep re-emerging as if they were ingrained in our DNA, it would be a good idea to start relearning our story coolheadedly, without glossing over the difficult bits.","It would be useful, for example, for us to know and explain that the sacred cause of the revolution was put at risk at critical moments by civil strife. Who knows, it might make us more suspicious of the preachers of division, who irresponsibly ? if not criminally ? have dragged the country through crises every 30-40 years.","The anniversary of the revolution is yet another opportunity to see how wise Greek diplomacy was from the beginning. It cultivated philhellenism with mastery and played its cards right with the Great Powers of the time. This is a chapter of history we ignore, because we prefer to remember only the historical events in which we appear as victims. Greece became independent and grew because of an unbeatable combination of heroism and wise diplomacy.","In this sense, the bicentenary is a milestone. An opportunity to look back, deepen our self-knowledge and set goals for the future. We should not forget that a people who do not know every aspect of their history are doomed to relive some of its darker chapters.","","","","","","","","","","",""
"42.html","The island of Kos became the first region of Greece to install electronic signs alerting to a possible tsunami, but a local hotelier association complained the signs are ?terrorizing? tourists.","?There is a possibility of a tsunami in Kos [in case of an earthquale],? Efthimios Lekkas, head of Greece?s Earthquake Planning and Protection Organization and director of the Geology and Geoenvironment Faculty at Athens University, told Open TV channel on Friday.","?We must not hide the problems under the carpet, because it costs lives.?","","","","","","","","","","","","","","","Kos installs tsunami alert amid complaints from hoteliers | News | ekathimerini.com","?There is a possibility of a tsunami in Kos [in case of an earthquale],? Efthimios Lekkas, head of Greece?s Earthquake Planning and Protection Organization and director of the Geology and Geoenvironment Faculty at Athens University, told Open TV channel on Friday.","NEWS","|","The island of Kos became the first region of Greece to install electronic signs alerting to a possible tsunami, but a local hotelier association complained the signs are ?terrorizing? tourists.","?There is a possibility of a tsunami in Kos [in case of an earthquale],? Efthimios Lekkas, head of Greece?s Earthquake Planning and Protection Organization and director of the Geology and Geoenvironment Faculty at Athens University, told Open TV channel on Friday.","?We must not hide the problems under the carpet, because it costs lives.?","","","","","","","","","","","","","","","?There is a possibility of a tsunami in Kos [in case of an earthquale],? Efthimios Lekkas, head of Greece?s Earthquake Planning and Protection Organization and director of the Geology and Geoenvironment Faculty at Athens University, told Open TV channel on Friday.","The island of Kos became the first region of Greece to install electronic signs alerting to a possible tsunami, but a local hotelier association complained the signs are ?terrorizing? tourists.","?There is a possibility of a tsunami in Kos [in case of an earthquale],? Efthimios Lekkas, head of Greece?s Earthquake Planning and Protection Organization and director of the Geology and Geoenvironment Faculty at Athens University, told Open TV channel on Friday.","?We must not hide the problems under the carpet, because it costs lives.?","","","","","","","","","","","","","","","Developed by EWORX S.A.","|","The island of Kos became the first region of Greece to install electronic signs alerting to a possible tsunami, but a local hotelier association complained the signs are ?terrorizing? tourists.","?There is a possibility of a tsunami in Kos [in case of an earthquale],? Efthimios Lekkas, head of Greece?s Earthquake Planning and Protection Organization and director of the Geology and Geoenvironment Faculty at Athens University, told Open TV channel on Friday.","?We must not hide the problems under the carpet, because it costs lives.?","","","","","","","","","","","","","",""
"45.html","Two Turkish CN-235 surveillance aircraft flew over the northeastern, central and southeastern Aegean on Thursday, defense sources said.","","","","","","","","","","","","","","","","","Turkish surveillance aircraft enter Greek airspace | News | ekathimerini.com","","NEWS","|","Two Turkish CN-235 surveillance aircraft flew over the northeastern, central and southeastern Aegean on Thursday, defense sources said.","","","","","","","","","","","","","","","","","","Two Turkish CN-235 surveillance aircraft flew over the northeastern, central and southeastern Aegean on Thursday, defense sources said.","","","","","","","","","","","","","","","","","Developed by EWORX S.A.","|","Two Turkish CN-235 surveillance aircraft flew over the northeastern, central and southeastern Aegean on Thursday, defense sources said.","","","","","","","","","","","","","","","",""
"17.html","Cyberspace presents many threats but also significant opportunities, according to Rami Efrati, one of the founding members and former head of the Civilian Division of the Israel National Cyber Bureau in the Prime Minister?s Office and present director of Firmitas Cyber Solutions.","Describing how Israel managed to turn cyberattacks into business opportunities, Efrati urges the Greek authorities to invest in creating an ecosystem that will halt the phenomenon of talented young people feeling forced to leave the country.","","","","","","","","","","","","","","","","Rami Efrati: Investing in cybersecurity can reverse brain drain | Community | ekathimerini.com","Describing how Israel managed to turn cyberattacks into business opportunities, Efrati urges the Greek authorities to invest in creating an ecosystem that will halt the phenomenon of talented young people feeling forced to leave the country.","COMMUNITY","|","Cyberspace presents many threats but also significant opportunities, according to Rami Efrati, one of the founding members and former head of the Civilian Division of the Israel National Cyber Bureau in the Prime Minister?s Office and present director of Firmitas Cyber Solutions.","Describing how Israel managed to turn cyberattacks into business opportunities, Efrati urges the Greek authorities to invest in creating an ecosystem that will halt the phenomenon of talented young people feeling forced to leave the country.","","","","","","","","","","","","","","","","Describing how Israel managed to turn cyberattacks into business opportunities, Efrati urges the Greek authorities to invest in creating an ecosystem that will halt the phenomenon of talented young people feeling forced to leave the country.","Cyberspace presents many threats but also significant opportunities, according to Rami Efrati, one of the founding members and former head of the Civilian Division of the Israel National Cyber Bureau in the Prime Minister?s Office and present director of Firmitas Cyber Solutions.","Describing how Israel managed to turn cyberattacks into business opportunities, Efrati urges the Greek authorities to invest in creating an ecosystem that will halt the phenomenon of talented young people feeling forced to leave the country.","","","","","","","","","","","","","","","","Developed by EWORX S.A.","|","Cyberspace presents many threats but also significant opportunities, according to Rami Efrati, one of the founding members and former head of the Civilian Division of the Israel National Cyber Bureau in the Prime Minister?s Office and present director of Firmitas Cyber Solutions.","Describing how Israel managed to turn cyberattacks into business opportunities, Efrati urges the Greek authorities to invest in creating an ecosystem that will halt the phenomenon of talented young people feeling forced to leave the country.","","","","","","","","","","","","","","",""
"25.html","Performances of traditional Greek dancing take place at the Dora Stratou Theater on Philopappou Hill in central Athens five nights a week from August 18 through September 22. Each of the shows focuses on a different part of the country and features more than 75 dancers, musicians and singers dressed in traditional costumes and jewelry.  Performances at the outdoor theater take place Wednesdays, Thursdays and Fridays, starting at 9.30pm, and Saturdays and Sundays at 8.30p.m. Tickets can be purchased at the theater before each show and cost 5, 10 or 15 euros. The theater also offers dance classes for beginners and advanced. Bookings can be made at mail@grdance.org.","Dora Stratou Theater, 33 Arakynthou, Philopappou Hill, tel 210.324.4395, 210.921.4650","","","","","","","","","","","","","","","","Traditional Performances | Athens | August 18 - September 22 | What?s On | ekathimerini.com","Dora Stratou Theater, 33 Arakynthou, Philopappou Hill, tel 210.324.4395, 210.921.4650","WHAT?S ON","|","Performances of traditional Greek dancing take place at the Dora Stratou Theater on Philopappou Hill in central Athens five nights a week from August 18 through September 22. Each of the shows focuses on a different part of the country and features more than 75 dancers, musicians and singers dressed in traditional costumes and jewelry.  Performances at the outdoor theater take place Wednesdays, Thursdays and Fridays, starting at 9.30pm, and Saturdays and Sundays at 8.30p.m. Tickets can be purchased at the theater before each show and cost 5, 10 or 15 euros. The theater also offers dance classes for beginners and advanced. Bookings can be made at mail@grdance.org.","Dora Stratou Theater, 33 Arakynthou, Philopappou Hill, tel 210.324.4395, 210.921.4650","","","","","","","","","","","","","","","","Dora Stratou Theater, 33 Arakynthou, Philopappou Hill, tel 210.324.4395, 210.921.4650","Performances of traditional Greek dancing take place at the Dora Stratou Theater on Philopappou Hill in central Athens five nights a week from August 18 through September 22. Each of the shows focuses on a different part of the country and features more than 75 dancers, musicians and singers dressed in traditional costumes and jewelry.  Performances at the outdoor theater take place Wednesdays, Thursdays and Fridays, starting at 9.30pm, and Saturdays and Sundays at 8.30p.m. Tickets can be purchased at the theater before each show and cost 5, 10 or 15 euros. The theater also offers dance classes for beginners and advanced. Bookings can be made at mail@grdance.org.","Dora Stratou Theater, 33 Arakynthou, Philopappou Hill, tel 210.324.4395, 210.921.4650","","","","","","","","","","","","","","","","Developed by EWORX S.A.","|","Performances of traditional Greek dancing take place at the Dora Stratou Theater on Philopappou Hill in central Athens five nights a week from August 18 through September 22. Each of the shows focuses on a different part of the country and features more than 75 dancers, musicians and singers dressed in traditional costumes and jewelry.  Performances at the outdoor theater take place Wednesdays, Thursdays and Fridays, starting at 9.30pm, and Saturdays and Sundays at 8.30p.m. Tickets can be purchased at the theater before each show and cost 5, 10 or 15 euros. The theater also offers dance classes for beginners and advanced. Bookings can be made at mail@grdance.org.","Dora Stratou Theater, 33 Arakynthou, Philopappou Hill, tel 210.324.4395, 210.921.4650","","","","","","","","","","","","","","",""
"48.html","Hundreds of firefighters battled three wildfires in Greece, where two villages were being evacuated Tuesday as the largest blaze burned a thickly forested nature reserve on the island of Evia north of Athens.","","","","","","","","","","","","","","","","","Villages evacuated as fire burns Greek island nature reserve | News | ekathimerini.com","","NEWS","|","Hundreds of firefighters battled three wildfires in Greece, where two villages were being evacuated Tuesday as the largest blaze burned a thickly forested nature reserve on the island of Evia north of Athens.","","","","","","","","","","","","","","","","","","Hundreds of firefighters battled three wildfires in Greece, where two villages were being evacuated Tuesday as the largest blaze burned a thickly forested nature reserve on the island of Evia north of Athens.","","","","","","","","","","","","","","","","","Developed by EWORX S.A.","|","Hundreds of firefighters battled three wildfires in Greece, where two villages were being evacuated Tuesday as the largest blaze burned a thickly forested nature reserve on the island of Evia north of Athens.","","","","","","","","","","","","","","","",""
