"pages","dividarticlesidebardiv1span1precedingsiblingp1textselftext","","","","","","","","","","","","","","","","","dividwrapperhead1title1text1selftext","piditemphotodescriptionspan1precedingsiblingp1br1followingsiblingtext1selftext","aidsitetitleprecedingsiblingtextselftext","","piditemtagsdiv1p1textselftext","","","","","","","","","","","","","","","","","sectionidb5414980015591330510100precedingsiblingprecedingsiblingp1br1followingsiblingtext1selftext","piditemtagsul1div1p1textselftext","","","","","","","","","","","","","","","","","aidtoolipprecedingsiblingtextselftext","","piditemphotodescriptionprecedingsiblingli1div1p1textselftext","","","","","","","","","","","","","","","",""
"44.html","A large firefighting force was sent to tackle a blaze that broke out on the island of Thassos, one of Greece?s greenest, on Tuesday morning.","The fire service said it sent 56 men with 25 vehicles at the area of Paradisos, in the southwestern part of the island. They were supported by two Pezetel aircraft and one helicopter.","Island mayor Kostas Hatziemmanouil told state-run news agency ANA-MPA authorities are trying to prevent the flames from reaching more inaccessible areas, but added that no villages are at risk.","","","","","","","","","","","","","","","Large blaze burning forestland on Thassos | News | ekathimerini.com","The fire service said it sent 56 men with 25 vehicles at the area of Paradisos, in the southwestern part of the island. They were supported by two Pezetel aircraft and one helicopter.","NEWS","|","A large firefighting force was sent to tackle a blaze that broke out on the island of Thassos, one of Greece?s greenest, on Tuesday morning.","The fire service said it sent 56 men with 25 vehicles at the area of Paradisos, in the southwestern part of the island. They were supported by two Pezetel aircraft and one helicopter.","Island mayor Kostas Hatziemmanouil told state-run news agency ANA-MPA authorities are trying to prevent the flames from reaching more inaccessible areas, but added that no villages are at risk.","","","","","","","","","","","","","","","The fire service said it sent 56 men with 25 vehicles at the area of Paradisos, in the southwestern part of the island. They were supported by two Pezetel aircraft and one helicopter.","A large firefighting force was sent to tackle a blaze that broke out on the island of Thassos, one of Greece?s greenest, on Tuesday morning.","The fire service said it sent 56 men with 25 vehicles at the area of Paradisos, in the southwestern part of the island. They were supported by two Pezetel aircraft and one helicopter.","Island mayor Kostas Hatziemmanouil told state-run news agency ANA-MPA authorities are trying to prevent the flames from reaching more inaccessible areas, but added that no villages are at risk.","","","","","","","","","","","","","","","Developed by EWORX S.A.","|","A large firefighting force was sent to tackle a blaze that broke out on the island of Thassos, one of Greece?s greenest, on Tuesday morning.","The fire service said it sent 56 men with 25 vehicles at the area of Paradisos, in the southwestern part of the island. They were supported by two Pezetel aircraft and one helicopter.","Island mayor Kostas Hatziemmanouil told state-run news agency ANA-MPA authorities are trying to prevent the flames from reaching more inaccessible areas, but added that no villages are at risk.","","","","","","","","","","","","","",""
"47.html","More than a thousand firefighters battled wildfires Tuesday in Greece, with the largest burning out of control through a nature reserve on the island of Evia north of Athens causing four villages and a monastery to be evacuated.","The country?s civil protection authority declared a state of emergency in the area of Evia affected by the fire, where about 280 firefighters, volunteers, soldiers, six water-dropping planes and six helicopters were deployed, along with one more helicopter coordinating the air support.","Greece called on the European civil protection organization for assistance, and four firefighting planes were being sent from Croatia and Italy, said Prime Minister Kyriakos Mitsotakis, who cut short his summer vacation and returned to the Greek capital to visit the fire department?s main coordination center.","?The conditions today are exceptionally difficult,? Mitsotakis said. He thanked firefighters for their efforts and said the government?s main concern was protecting human life.","Strong winds fanned the fire in the thickly forested Evia reserve, as well as several more wildfires burning Tuesday in Greece. A total of 56 forest fires broke out around the country in a 24-hour period spanning Monday night and Tuesday.","More than 1,000 firefighters in all were assigned to the blazes. A volunteer firefighter reportedly burned on the island was transported to a hospital in Athens.","?The most important thing is to not have any human casualties,? Interior Minister Takis Theodorikakos said in a telephone interview aired on state television.","Smoke from the Evia fire blanketed Athens in the morning. Authorities warned people in affected areas, particularly the elderly, young children and those suffering from breathing or heart conditions, to remain indoors and set air conditioning units to recycle indoor air.","The blaze broke out shortly after 3 a.m. local time, the civil protection authority said, and strong winds helped spread it through the dense pine forest.","More than 300 people from four villages were gradually evacuated during the day, many riding on buses and others going out in their own vehicles.","?The fire trapped us at Makrimalli, and we had to leave quickly,? said Nikos Petrou, referring to one of the villages that were ordered evacuated. ?As I was leaving, the fire was coming behind us.?","A separate blaze broke out on the north part of Evia, and 15 firefighters, a helicopter and a small plane worked to keep it from spreading.","Dozens more firefighters, two planes and a helicopter tackled a separate forest fire on the northern island of Thassos. Another wildfire was burning through brush and dried weeds near Thebes, northwest of Athens.","More than 30 firefighters tackled yet another in southern Greece; the fire department said it was brought under partial control after about an hour.","On Tuesday afternoon, an additional blaze broke out in southern Greece.","Forest fires are common in Greece during the hot, dry summer months. Authorities have repeatedly warned the public not to engage in outdoor activities that could cause fires, such as welding work, burning dried weeds or lighting campfires and barbecues. Parks and forest areas are closed to the public at times of high fire risk.","Last year, more than 100 people died when a fast-moving forest fire broke out in a seaside area northeast of Athens and raged through a nearby settlement of mainly holiday homes. The fire trapped people in their cars as they attempted to flee, while many other victims drowned as they tried to swim away from beaches overcome by heat and choking smoke. [AP]","Fire rages out of control in Greek island nature reserve | News | ekathimerini.com","The country?s civil protection authority declared a state of emergency in the area of Evia affected by the fire, where about 280 firefighters, volunteers, soldiers, six water-dropping planes and six helicopters were deployed, along with one more helicopter coordinating the air support.","NEWS","|","More than a thousand firefighters battled wildfires Tuesday in Greece, with the largest burning out of control through a nature reserve on the island of Evia north of Athens causing four villages and a monastery to be evacuated.","The country?s civil protection authority declared a state of emergency in the area of Evia affected by the fire, where about 280 firefighters, volunteers, soldiers, six water-dropping planes and six helicopters were deployed, along with one more helicopter coordinating the air support.","Greece called on the European civil protection organization for assistance, and four firefighting planes were being sent from Croatia and Italy, said Prime Minister Kyriakos Mitsotakis, who cut short his summer vacation and returned to the Greek capital to visit the fire department?s main coordination center.","?The conditions today are exceptionally difficult,? Mitsotakis said. He thanked firefighters for their efforts and said the government?s main concern was protecting human life.","Strong winds fanned the fire in the thickly forested Evia reserve, as well as several more wildfires burning Tuesday in Greece. A total of 56 forest fires broke out around the country in a 24-hour period spanning Monday night and Tuesday.","More than 1,000 firefighters in all were assigned to the blazes. A volunteer firefighter reportedly burned on the island was transported to a hospital in Athens.","?The most important thing is to not have any human casualties,? Interior Minister Takis Theodorikakos said in a telephone interview aired on state television.","Smoke from the Evia fire blanketed Athens in the morning. Authorities warned people in affected areas, particularly the elderly, young children and those suffering from breathing or heart conditions, to remain indoors and set air conditioning units to recycle indoor air.","The blaze broke out shortly after 3 a.m. local time, the civil protection authority said, and strong winds helped spread it through the dense pine forest.","More than 300 people from four villages were gradually evacuated during the day, many riding on buses and others going out in their own vehicles.","?The fire trapped us at Makrimalli, and we had to leave quickly,? said Nikos Petrou, referring to one of the villages that were ordered evacuated. ?As I was leaving, the fire was coming behind us.?","A separate blaze broke out on the north part of Evia, and 15 firefighters, a helicopter and a small plane worked to keep it from spreading.","Dozens more firefighters, two planes and a helicopter tackled a separate forest fire on the northern island of Thassos. Another wildfire was burning through brush and dried weeds near Thebes, northwest of Athens.","More than 30 firefighters tackled yet another in southern Greece; the fire department said it was brought under partial control after about an hour.","On Tuesday afternoon, an additional blaze broke out in southern Greece.","Forest fires are common in Greece during the hot, dry summer months. Authorities have repeatedly warned the public not to engage in outdoor activities that could cause fires, such as welding work, burning dried weeds or lighting campfires and barbecues. Parks and forest areas are closed to the public at times of high fire risk.","Last year, more than 100 people died when a fast-moving forest fire broke out in a seaside area northeast of Athens and raged through a nearby settlement of mainly holiday homes. The fire trapped people in their cars as they attempted to flee, while many other victims drowned as they tried to swim away from beaches overcome by heat and choking smoke. [AP]","The country?s civil protection authority declared a state of emergency in the area of Evia affected by the fire, where about 280 firefighters, volunteers, soldiers, six water-dropping planes and six helicopters were deployed, along with one more helicopter coordinating the air support.","More than a thousand firefighters battled wildfires Tuesday in Greece, with the largest burning out of control through a nature reserve on the island of Evia north of Athens causing four villages and a monastery to be evacuated.","The country?s civil protection authority declared a state of emergency in the area of Evia affected by the fire, where about 280 firefighters, volunteers, soldiers, six water-dropping planes and six helicopters were deployed, along with one more helicopter coordinating the air support.","Greece called on the European civil protection organization for assistance, and four firefighting planes were being sent from Croatia and Italy, said Prime Minister Kyriakos Mitsotakis, who cut short his summer vacation and returned to the Greek capital to visit the fire department?s main coordination center.","?The conditions today are exceptionally difficult,? Mitsotakis said. He thanked firefighters for their efforts and said the government?s main concern was protecting human life.","Strong winds fanned the fire in the thickly forested Evia reserve, as well as several more wildfires burning Tuesday in Greece. A total of 56 forest fires broke out around the country in a 24-hour period spanning Monday night and Tuesday.","More than 1,000 firefighters in all were assigned to the blazes. A volunteer firefighter reportedly burned on the island was transported to a hospital in Athens.","?The most important thing is to not have any human casualties,? Interior Minister Takis Theodorikakos said in a telephone interview aired on state television.","Smoke from the Evia fire blanketed Athens in the morning. Authorities warned people in affected areas, particularly the elderly, young children and those suffering from breathing or heart conditions, to remain indoors and set air conditioning units to recycle indoor air.","The blaze broke out shortly after 3 a.m. local time, the civil protection authority said, and strong winds helped spread it through the dense pine forest.","More than 300 people from four villages were gradually evacuated during the day, many riding on buses and others going out in their own vehicles.","?The fire trapped us at Makrimalli, and we had to leave quickly,? said Nikos Petrou, referring to one of the villages that were ordered evacuated. ?As I was leaving, the fire was coming behind us.?","A separate blaze broke out on the north part of Evia, and 15 firefighters, a helicopter and a small plane worked to keep it from spreading.","Dozens more firefighters, two planes and a helicopter tackled a separate forest fire on the northern island of Thassos. Another wildfire was burning through brush and dried weeds near Thebes, northwest of Athens.","More than 30 firefighters tackled yet another in southern Greece; the fire department said it was brought under partial control after about an hour.","On Tuesday afternoon, an additional blaze broke out in southern Greece.","Forest fires are common in Greece during the hot, dry summer months. Authorities have repeatedly warned the public not to engage in outdoor activities that could cause fires, such as welding work, burning dried weeds or lighting campfires and barbecues. Parks and forest areas are closed to the public at times of high fire risk.","Last year, more than 100 people died when a fast-moving forest fire broke out in a seaside area northeast of Athens and raged through a nearby settlement of mainly holiday homes. The fire trapped people in their cars as they attempted to flee, while many other victims drowned as they tried to swim away from beaches overcome by heat and choking smoke. [AP]","Developed by EWORX S.A.","|","More than a thousand firefighters battled wildfires Tuesday in Greece, with the largest burning out of control through a nature reserve on the island of Evia north of Athens causing four villages and a monastery to be evacuated.","The country?s civil protection authority declared a state of emergency in the area of Evia affected by the fire, where about 280 firefighters, volunteers, soldiers, six water-dropping planes and six helicopters were deployed, along with one more helicopter coordinating the air support.","Greece called on the European civil protection organization for assistance, and four firefighting planes were being sent from Croatia and Italy, said Prime Minister Kyriakos Mitsotakis, who cut short his summer vacation and returned to the Greek capital to visit the fire department?s main coordination center.","?The conditions today are exceptionally difficult,? Mitsotakis said. He thanked firefighters for their efforts and said the government?s main concern was protecting human life.","Strong winds fanned the fire in the thickly forested Evia reserve, as well as several more wildfires burning Tuesday in Greece. A total of 56 forest fires broke out around the country in a 24-hour period spanning Monday night and Tuesday.","More than 1,000 firefighters in all were assigned to the blazes. A volunteer firefighter reportedly burned on the island was transported to a hospital in Athens.","?The most important thing is to not have any human casualties,? Interior Minister Takis Theodorikakos said in a telephone interview aired on state television.","Smoke from the Evia fire blanketed Athens in the morning. Authorities warned people in affected areas, particularly the elderly, young children and those suffering from breathing or heart conditions, to remain indoors and set air conditioning units to recycle indoor air.","The blaze broke out shortly after 3 a.m. local time, the civil protection authority said, and strong winds helped spread it through the dense pine forest.","More than 300 people from four villages were gradually evacuated during the day, many riding on buses and others going out in their own vehicles.","?The fire trapped us at Makrimalli, and we had to leave quickly,? said Nikos Petrou, referring to one of the villages that were ordered evacuated. ?As I was leaving, the fire was coming behind us.?","A separate blaze broke out on the north part of Evia, and 15 firefighters, a helicopter and a small plane worked to keep it from spreading.","Dozens more firefighters, two planes and a helicopter tackled a separate forest fire on the northern island of Thassos. Another wildfire was burning through brush and dried weeds near Thebes, northwest of Athens.","More than 30 firefighters tackled yet another in southern Greece; the fire department said it was brought under partial control after about an hour.","On Tuesday afternoon, an additional blaze broke out in southern Greece.","Forest fires are common in Greece during the hot, dry summer months. Authorities have repeatedly warned the public not to engage in outdoor activities that could cause fires, such as welding work, burning dried weeds or lighting campfires and barbecues. Parks and forest areas are closed to the public at times of high fire risk.","Last year, more than 100 people died when a fast-moving forest fire broke out in a seaside area northeast of Athens and raged through a nearby settlement of mainly holiday homes. The fire trapped people in their cars as they attempted to flee, while many other victims drowned as they tried to swim away from beaches overcome by heat and choking smoke. [AP]"
"58.html","As Turkey continues with its provocative behavior in the Eastern Mediterranean, despite European Union calls for it to desist from drilling for oil in Cyprus? exclusive economic zone (EEZ), Greece?s armed forces are on standby to deal with a possible escalation of tensions in the East Med or the Aegean, Kathimerini understands.","","","","","","","","","","","","","","","","","Greek armed forces on standby for Turkish moves in East Med, Aegean | News | ekathimerini.com","","NEWS","|","As Turkey continues with its provocative behavior in the Eastern Mediterranean, despite European Union calls for it to desist from drilling for oil in Cyprus? exclusive economic zone (EEZ), Greece?s armed forces are on standby to deal with a possible escalation of tensions in the East Med or the Aegean, Kathimerini understands.","","","","","","","","","","","","","","","","","","As Turkey continues with its provocative behavior in the Eastern Mediterranean, despite European Union calls for it to desist from drilling for oil in Cyprus? exclusive economic zone (EEZ), Greece?s armed forces are on standby to deal with a possible escalation of tensions in the East Med or the Aegean, Kathimerini understands.","","","","","","","","","","","","","","","","","Developed by EWORX S.A.","|","As Turkey continues with its provocative behavior in the Eastern Mediterranean, despite European Union calls for it to desist from drilling for oil in Cyprus? exclusive economic zone (EEZ), Greece?s armed forces are on standby to deal with a possible escalation of tensions in the East Med or the Aegean, Kathimerini understands.","","","","","","","","","","","","","","","",""
"16.html","He possesses the drive and energy that are typical of people with purpose and vision. And yet there is also the warmth, optimism and kindness that develops in those who had to face many challenges and put a huge effort into seeing their dreams come true. We met with Theoharis Theoharides, professor of pharmacology and internal medicine at the Department of Immunology at Tufts University School of Medicine in Boston, on the occasion of his collaboration with Deree ? The American College of Greece in Athens, where he serves part-time as director of Health Science Programs and Research.","He has personally seen to the solid organization of the college?s new Biomedical Sciences program, which will welcome its first students in the new academic year, and his excitement is palpable from the first moments of our conversation: ?This is a very significant effort for the ACG, for Greece and for science in general,? he points out.","","","","","","","","","","","","","","","","?For greater funding, we need a science dream team? | Community | ekathimerini.com","He has personally seen to the solid organization of the college?s new Biomedical Sciences program, which will welcome its first students in the new academic year, and his excitement is palpable from the first moments of our conversation: ?This is a very significant effort for the ACG, for Greece and for science in general,? he points out.","COMMUNITY","|","He possesses the drive and energy that are typical of people with purpose and vision. And yet there is also the warmth, optimism and kindness that develops in those who had to face many challenges and put a huge effort into seeing their dreams come true. We met with Theoharis Theoharides, professor of pharmacology and internal medicine at the Department of Immunology at Tufts University School of Medicine in Boston, on the occasion of his collaboration with Deree ? The American College of Greece in Athens, where he serves part-time as director of Health Science Programs and Research.","He has personally seen to the solid organization of the college?s new Biomedical Sciences program, which will welcome its first students in the new academic year, and his excitement is palpable from the first moments of our conversation: ?This is a very significant effort for the ACG, for Greece and for science in general,? he points out.","","","","","","","","","","","","","","","","He has personally seen to the solid organization of the college?s new Biomedical Sciences program, which will welcome its first students in the new academic year, and his excitement is palpable from the first moments of our conversation: ?This is a very significant effort for the ACG, for Greece and for science in general,? he points out.","He possesses the drive and energy that are typical of people with purpose and vision. And yet there is also the warmth, optimism and kindness that develops in those who had to face many challenges and put a huge effort into seeing their dreams come true. We met with Theoharis Theoharides, professor of pharmacology and internal medicine at the Department of Immunology at Tufts University School of Medicine in Boston, on the occasion of his collaboration with Deree ? The American College of Greece in Athens, where he serves part-time as director of Health Science Programs and Research.","He has personally seen to the solid organization of the college?s new Biomedical Sciences program, which will welcome its first students in the new academic year, and his excitement is palpable from the first moments of our conversation: ?This is a very significant effort for the ACG, for Greece and for science in general,? he points out.","","","","","","","","","","","","","","","","Developed by EWORX S.A.","|","He possesses the drive and energy that are typical of people with purpose and vision. And yet there is also the warmth, optimism and kindness that develops in those who had to face many challenges and put a huge effort into seeing their dreams come true. We met with Theoharis Theoharides, professor of pharmacology and internal medicine at the Department of Immunology at Tufts University School of Medicine in Boston, on the occasion of his collaboration with Deree ? The American College of Greece in Athens, where he serves part-time as director of Health Science Programs and Research.","He has personally seen to the solid organization of the college?s new Biomedical Sciences program, which will welcome its first students in the new academic year, and his excitement is palpable from the first moments of our conversation: ?This is a very significant effort for the ACG, for Greece and for science in general,? he points out.","","","","","","","","","","","","","","",""
